{
	"$schema": "../../../schema/v1/source.schema.json",
	"extends": "tanchjim-ktmicro",
	"id": "tanchjim-ea-force",
	"device": { "brand": "Tanchjim", "model": "EA Force" },
	"match": { "usb": [{ "vendorId": "0x31b2", "productName": "TANCHJIM-EA FORCE" }] },
	"meta": {
		"status": "draft",
		"sources": [
			{
				"kind": "vendor-app",
				"ref": "TANCHJIM Android app 2.5.7.4 (com.tanchjim.android): DeviceBaseInfo, DeviceInfoHelper",
				"date": "2026-10-28"
			}
		],
		"notes": "The app names it \"TANCHJIM-EA FORCE\". Its USB ids aren't known yet: it matches by KT Micro's vendor id, which every Tanchjim KT Micro device recorded so far has, and that name, which the app compares as a substring and this profile exactly."
	}
}
