{
	"$schema": "../../../schema/v1/source.schema.json",
	"extends": "fiio-peq-10-band-12db-wide-all-filters",
	"id": "fiio-qx13",
	"schemaVersion": "1.1",
	"device": { "brand": "FiiO", "model": "QX13" },
	"match": {
		"usb": [
			{ "vendorId": "0x2972", "productId": "0x0128", "productName": "FIIO QX13" },
			{ "vendorId": ["0x0a12", "0x2972"], "productName": "FIIO QX13" }
		]
	},
	"protocol": {
		"presets": [
			{ "id": 0, "name": "Jazz" },
			{ "id": 1, "name": "Pop" },
			{ "id": 2, "name": "Rock" },
			{ "id": 3, "name": "Dance" },
			{ "id": 4, "name": "R&B" },
			{ "id": 5, "name": "Classic" },
			{ "id": 6, "name": "Hip-hop" },
			{ "id": 8, "name": "Retro" },
			{ "id": 160, "name": "USER1", "writable": true },
			{ "id": 161, "name": "USER2", "writable": true },
			{ "id": 162, "name": "USER3", "writable": true },
			{ "id": 163, "name": "USER4", "writable": true },
			{ "id": 164, "name": "USER5", "writable": true },
			{ "id": 165, "name": "USER6", "writable": true },
			{ "id": 166, "name": "USER7", "writable": true },
			{ "id": 167, "name": "USER8", "writable": true },
			{ "id": 168, "name": "USER9", "writable": true },
			{ "id": 169, "name": "USER10", "writable": true },
			{ "id": 240, "name": "BYPASS", "bypass": true }
		]
	},
	"meta": {
		"status": "draft",
		"sources": [
			{
				"kind": "handler-code",
				"ref": "https://github.com/jeromeof/devicePEQ/blob/0617f382e76629792a5933e6933e4b396a756a93/devicePEQ/usbDeviceConfig.js",
				"date": "2026-10-02"
			},
			{
				"kind": "handler-code",
				"ref": "https://github.com/jeromeof/devicePEQ/blob/0617f382e76629792a5933e6933e4b396a756a93/tests/captures/fiio_fiio_qx13.json",
				"date": "2026-10-02"
			}
		],
		"notes": "devicePEQ's peakingAlpha shelf setting is not a law here: it converts its own slope convention to the Q this engine takes, which is exact RBJ Q (prior-art §2.1). Reported quirk, not corrected (D39): devicePEQ reports that peaking filters come out wider than the Q sent as gain grows (Q / 10^(|gain|/40))."
	}
}
