{
	"$schema": "../../../schema/v1/source.schema.json",
	"extends": "walkplay-peq-10-band-10db-full-shelves",
	"id": "walkplay-schemeno16-devices",
	"device": { "brand": "Walkplay", "model": "SchemeNo16 devices", "group": true },
	"match": {
		"usb": [
			{
				"vendorId": [
					"0x0104",
					"0x011b",
					"0x011d",
					"0x0661",
					"0x0663",
					"0x0666",
					"0x0762",
					"0x0909",
					"0x0d8c",
					"0x2fc6",
					"0x3302",
					"0x34be",
					"0x35d8",
					"0x36a7",
					"0x373b",
					"0x60c1",
					"0x60e1",
					"0xb445",
					"0xb44d"
				],
				"productId": [
					"0x011d",
					"0x39e0",
					"0x4301",
					"0x4304",
					"0x4305",
					"0x4306",
					"0x430d",
					"0x430e",
					"0x430f",
					"0x4311",
					"0x4312",
					"0x4313",
					"0x4316",
					"0x4318",
					"0x4319",
					"0x431d",
					"0x4321",
					"0x4323",
					"0x4324",
					"0x4325",
					"0x4326",
					"0x4327",
					"0x4329",
					"0x432a",
					"0x432c",
					"0x4351",
					"0x4352",
					"0x4355",
					"0x4358",
					"0x4359",
					"0x435a",
					"0x435c",
					"0x435d",
					"0x435e",
					"0x4360",
					"0x4361",
					"0x4363",
					"0x4364",
					"0x4366",
					"0x4367",
					"0x4380",
					"0x4381",
					"0x4382",
					"0x4383",
					"0x4386",
					"0x43b1",
					"0x43b6",
					"0x43b7",
					"0x43b8",
					"0x43bc",
					"0x43be",
					"0x43bf",
					"0x43c0",
					"0x43c2",
					"0x43c5",
					"0x43c6",
					"0x43c7",
					"0x43c8",
					"0x43c9",
					"0x43ca",
					"0x43cc",
					"0x43cd",
					"0x43cf",
					"0x43d7",
					"0x43d8",
					"0x43da",
					"0x43db",
					"0x43de",
					"0x43e1",
					"0x43e4",
					"0x43e6",
					"0x43e8",
					"0x43ec",
					"0x43ef",
					"0x9201",
					"0x98d4",
					"0xee10",
					"0xee20",
					"0xf808"
				]
			}
		]
	},
	"meta": {
		"status": "draft",
		"sources": [
			{
				"kind": "handler-code",
				"ref": "https://github.com/jeromeof/devicePEQ/blob/0617f382e76629792a5933e6933e4b396a756a93/devicePEQ/usbDeviceConfig.js",
				"date": "2026-10-02"
			}
		],
		"notes": "Every product id devicePEQ assigns to its \"SchemeNo16\" group, under each vendor id of the vendor block. devicePEQ doesn't record which vendor id goes with which product id, so most of these pairs don't exist. Replace with device profiles as devices are identified: 0x4322 is now nicehck-pureaural. 1 product id(s) of this group also appear in an earlier group, which devicePEQ checks first; they match that group's profile."
	}
}
