{
	"$schema": "../../../schema/v1/source.schema.json",
	"id": "tanchjim-rita",
	"schemaVersion": "1.0",
	"kind": "hardware",
	"device": { "brand": "Tanchjim", "model": "Rita" },
	"match": {
		"bluetooth": [
			{ "namePrefix": "Tanchjim Rita", "serviceUuid": "00001101-0000-1000-8000-00805f9b34fb" }
		]
	},
	"bandCount": 12,
	"band": {
		"types": ["PK"],
		"freq": { "min": 20, "max": 20000, "step": 1 },
		"q": { "min": 0.1, "max": 16, "step": 0.01 },
		"gain": { "min": -15, "max": 15, "step": 0.01 }
	},
	"preamp": { "mode": "none" },
	"protocol": { "handler": "tanchjim-rita-serial", "presets": [{ "id": 0, "name": "Custom EQ" }] },
	"meta": {
		"status": "draft",
		"sources": [
			{
				"kind": "handler-code",
				"ref": "https://github.com/jeromeof/devicePEQ/blob/0617f382e76629792a5933e6933e4b396a756a93/devicePEQ/usbSerialDeviceConfig.js",
				"date": "2026-10-02"
			}
		],
		"notes": "Seeded from devicePEQ by scripts/import/seed.ts. Values are what devicePEQ's handler encodes, not verified device limits. The Bluetooth name is a placeholder until confirmed: devicePEQ identifies this device only by its serial service class. devicePEQ's shared constraints list shelves, but its handler writes every band with type byte 0x01 and reads every band as peaking: only peaking can be sent until the shelf codes are known (corrected 2026-10-02)."
	}
}
