{
	"$schema": "../../schema/v1/source.schema.json",
	"extends": "walkplay-hid",
	"abstract": true,
	"id": "walkplay-peq-10-band-10db-full-shelves",
	"bandCount": 10,
	"band": { "types": ["PK", "LSC", "HSC"] },
	"meta": {
		"status": "draft",
		"sources": [
			{
				"kind": "handler-code",
				"ref": "https://github.com/jeromeof/devicePEQ/blob/0617f382e76629792a5933e6933e4b396a756a93/devicePEQ/peqConstraintsConfig.json",
				"date": "2026-10-02"
			}
		],
		"notes": "devicePEQ's shared constraints \"peq10Band10dBFullShelves\" and \"walkplayPeq10Band10dBFullShelves\". Seeded by scripts/import/seed.ts; ranges are what the handler encodes, not verified firmware limits."
	}
}
