{
	"$schema": "../../../schema/v1/source.schema.json",
	"id": "nothing-headphone-1",
	"schemaVersion": "1.1",
	"kind": "hardware",
	"device": { "brand": "Nothing", "model": "Headphone (1)" },
	"match": {
		"bluetooth": [
			{ "namePrefix": "Nothing Headphone", "serviceUuid": "aeac4a03-dff5-498f-843a-34487cf133eb" }
		]
	},
	"bandCount": 8,
	"band": {
		"types": ["PK", "LSC", "HSC"],
		"freq": { "min": 20, "max": 20000 },
		"q": { "min": 0.1, "max": 10 },
		"gain": { "min": -12, "max": 12 }
	},
	"preamp": { "mode": "unknown" },
	"protocol": {
		"handler": "nothing-usb-serial",
		"presets": [
			{ "id": 0, "name": "Balanced" },
			{ "id": 1, "name": "Voice" },
			{ "id": 2, "name": "More Treble" },
			{ "id": 3, "name": "More Bass" },
			{ "id": 5, "name": "Custom", "writable": true }
		]
	},
	"meta": {
		"status": "draft",
		"sources": [
			{
				"kind": "handler-code",
				"ref": "https://github.com/jeromeof/devicePEQ/blob/0617f382e76629792a5933e6933e4b396a756a93/devicePEQ/usbSerialDeviceConfig.js",
				"date": "2026-10-02"
			}
		],
		"notes": "Seeded from devicePEQ by scripts/import/seed.ts. Values are what devicePEQ's handler encodes, not verified device limits. The Bluetooth name is a placeholder until confirmed: devicePEQ identifies this device only by its serial service class."
	}
}
