{
	"$schema": "../../../schema/v1/source.schema.json",
	"extends": "walkplay-peq-8-band-10db-full-shelves",
	"id": "walkplay-dual-cs43198",
	"schemaVersion": "1.0",
	"kind": "hardware",
	"device": { "brand": "Walkplay", "model": "Dual CS43198", "group": true },
	"match": {
		"usb": [
			{ "vendorId": "0x0104", "productName": "Dual CS43198" },
			{ "vendorId": "0x011b", "productName": "Dual CS43198" },
			{ "vendorId": "0x011d", "productName": "Dual CS43198" },
			{ "vendorId": "0x0661", "productName": "Dual CS43198" },
			{ "vendorId": "0x0663", "productName": "Dual CS43198" },
			{ "vendorId": "0x0666", "productName": "Dual CS43198" },
			{ "vendorId": "0x0762", "productName": "Dual CS43198" },
			{ "vendorId": "0x0909", "productName": "Dual CS43198" },
			{ "vendorId": "0x0d8c", "productName": "Dual CS43198" },
			{ "vendorId": "0x2fc6", "productName": "Dual CS43198" },
			{ "vendorId": "0x3302", "productName": "Dual CS43198" },
			{ "vendorId": "0x34be", "productName": "Dual CS43198" },
			{ "vendorId": "0x35d8", "productName": "Dual CS43198" },
			{ "vendorId": "0x36a7", "productName": "Dual CS43198" },
			{ "vendorId": "0x373b", "productName": "Dual CS43198" },
			{ "vendorId": "0x60c1", "productName": "Dual CS43198" },
			{ "vendorId": "0x60e1", "productName": "Dual CS43198" },
			{ "vendorId": "0xb445", "productName": "Dual CS43198" },
			{ "vendorId": "0xb44d", "productName": "Dual CS43198" }
		]
	},
	"protocol": { "experimental": true },
	"meta": {
		"status": "draft",
		"sources": [
			{
				"kind": "handler-code",
				"ref": "https://github.com/jeromeof/devicePEQ/blob/0617f382e76629792a5933e6933e4b396a756a93/devicePEQ/usbDeviceConfig.js",
				"date": "2026-10-02"
			}
		],
		"notes": "Seeded from devicePEQ by scripts/import/seed.ts. Values are what devicePEQ's handler encodes, not verified device limits. devicePEQ marks this device experimental."
	}
}
