{
	"$schema": "../../../schema/v1/source.schema.json",
	"extends": "fiio-peq-10-band-12db-all-filters-7",
	"id": "fiio-btr13",
	"schemaVersion": "1.1",
	"device": { "brand": "FiiO", "model": "BTR13" },
	"match": { "usb": [{ "vendorId": ["0x0a12", "0x2972"], "productName": "FIIO BTR13" }] },
	"protocol": {
		"presets": [
			{ "id": 0, "name": "Jazz" },
			{ "id": 1, "name": "Pop" },
			{ "id": 2, "name": "Rock" },
			{ "id": 3, "name": "Dance" },
			{ "id": 4, "name": "R&B" },
			{ "id": 5, "name": "Classic" },
			{ "id": 6, "name": "Hip-hop" },
			{ "id": 7, "name": "USER1", "writable": true },
			{ "id": 8, "name": "USER2", "writable": true },
			{ "id": 9, "name": "USER3", "writable": true },
			{ "id": 11, "name": "Close EQ", "bypass": true }
		]
	},
	"meta": {
		"status": "draft",
		"sources": [
			{
				"kind": "handler-code",
				"ref": "https://github.com/jeromeof/devicePEQ/blob/0617f382e76629792a5933e6933e4b396a756a93/devicePEQ/usbDeviceConfig.js",
				"date": "2026-10-02"
			}
		]
	}
}
