{
	"$schema": "../../schema/v1/source.schema.json",
	"abstract": true,
	"id": "fiio-peq-5-band-12db-full-shelves",
	"schemaVersion": "1.0",
	"kind": "hardware",
	"bandCount": 5,
	"band": {
		"types": ["PK", "LSC", "HSC"],
		"freq": { "min": 20, "max": 20000, "step": 1 },
		"q": { "min": 0.1, "max": 10, "step": 0.01 },
		"gain": { "min": -12, "max": 12, "step": 0.1 }
	},
	"preamp": { "mode": "manual", "gain": { "min": -12, "max": 12, "step": 0.1 } },
	"protocol": { "handler": "fiio-usb-hid" },
	"meta": {
		"status": "draft",
		"sources": [
			{
				"kind": "handler-code",
				"ref": "https://github.com/jeromeof/devicePEQ/blob/0617f382e76629792a5933e6933e4b396a756a93/devicePEQ/peqConstraintsConfig.json",
				"date": "2026-10-02"
			},
			{
				"kind": "handler-code",
				"ref": "https://github.com/jeromeof/devicePEQ/blob/0617f382e76629792a5933e6933e4b396a756a93/devicePEQ/fiioUsbHidHandler.js",
				"date": "2026-10-02"
			}
		],
		"notes": "devicePEQ's shared constraints \"peq5Band12dBFullShelves\", with the wire grids of fiioUsbHidHandler.js. Seeded by scripts/import/seed.ts; ranges are what the handler encodes, not verified firmware limits."
	}
}
